{
  "schema_version": "1.0",
  "bmad_story_key": "11-1-minimal-knowledge-store-and-retrieval-projection",
  "bmad_epic_key": "11",
  "feature_directory": "specs/004-minimal-knowledge-store",
  "execution_level": "expedited-mvp",
  "stage": "complete",
  "active_gates": {
    "acceptance-review": {
      "status": "invalidated",
      "iteration": 0,
      "dispatch_id": null,
      "verdict_path": null,
      "input_boundary": null,
      "completed_at": null
    },
    "quality-review": {
      "status": "accepted",
      "iteration": 3,
      "dispatch_id": "story111-recovered-quality",
      "verdict_path": "specs/004-minimal-knowledge-store/reviews/quality-review/quality-review-recovery-f23f6ee.json",
      "input_boundary": {
        "base_commit": "3fe347c5a9bdcd15a3f24b3e4fb2b2c4a277a427",
        "candidate_commit": "f23f6ee38d1dc6602dde43d4e2a1b4aa54e03b4d",
        "diff_sha256": "228ba301b9752490acd495bdeeba665fce8ac5b188594aeb0cf044c0c1344d9a",
        "artifact_hashes": {
          "specs/004-minimal-knowledge-store/reviews/quality-review/quality-review-recovery-f23f6ee.json": "1a06f945e244f16b9fab68b8d7d0a0af5b354167638c3afaabbc6cd72fd5b2f1"
        },
        "owned_paths": [
          "specs/004-minimal-knowledge-store/reviews/quality-review/quality-review-recovery-f23f6ee.json"
        ]
      },
      "completed_at": "2026-07-31T09:02:55Z"
    }
  },
  "stage_history": [
    {
      "stage": "context",
      "status": "accepted",
      "started_at": "2026-07-30T13:01:38Z",
      "completed_at": "2026-07-30T13:01:38Z",
      "input_commit": "b851ba165d6ebe560227bfdc3b206a814280e9b2",
      "input_hashes": {},
      "agent_role": "story-context-synthesizer",
      "evidence_paths": [
        "docs/bmad/implementation-artifacts/11-1-minimal-knowledge-store-and-retrieval-projection.md"
      ],
      "failure": null
    },
    {
      "stage": "specify",
      "status": "accepted",
      "started_at": "2026-07-30T13:01:38Z",
      "completed_at": "2026-07-30T13:09:43Z",
      "input_commit": "b851ba165d6ebe560227bfdc3b206a814280e9b2",
      "input_hashes": {
        "specs/004-minimal-knowledge-store/spec.md": "c7a36a49663eef0a556d5488a4d832ef5c9bf8aa12bb01ecedc87e4a23e5843d"
      },
      "agent_role": "spec-author",
      "evidence_paths": [
        "specs/004-minimal-knowledge-store/spec.md"
      ],
      "failure": null
    },
    {
      "stage": "spec-review",
      "status": "invalidated",
      "started_at": "2026-07-30T13:09:43Z",
      "completed_at": "2026-07-30T13:09:43Z",
      "input_commit": "b851ba165d6ebe560227bfdc3b206a814280e9b2",
      "input_hashes": {},
      "agent_role": "bmad-sprint-orchestrator",
      "evidence_paths": [],
      "failure": null
    },
    {
      "stage": "plan",
      "status": "accepted",
      "started_at": "2026-07-30T13:10:37Z",
      "completed_at": "2026-07-31T01:02:00Z",
      "input_commit": "b851ba165d6ebe560227bfdc3b206a814280e9b2",
      "input_hashes": {
        "specs/004-minimal-knowledge-store/plan.md": "3b1ff499ef67d7a2d072813631a01f993648e27e90e5379735fcaf2de97d7184"
      },
      "agent_role": "plan-architect",
      "evidence_paths": [
        "specs/004-minimal-knowledge-store/plan.md"
      ],
      "failure": null
    },
    {
      "stage": "plan-review",
      "status": "accepted",
      "started_at": "2026-07-30T23:00:00Z",
      "completed_at": "2026-07-31T01:02:00Z",
      "input_commit": "b851ba165d6ebe560227bfdc3b206a814280e9b2",
      "input_hashes": {
        "specs/004-minimal-knowledge-store/plan.md": "3b1ff499ef67d7a2d072813631a01f993648e27e90e5379735fcaf2de97d7184"
      },
      "agent_role": "plan-judge",
      "evidence_paths": [
        "specs/004-minimal-knowledge-store/plan.md"
      ],
      "failure": null
    },
    {
      "stage": "tasks",
      "status": "accepted",
      "started_at": "2026-07-31T00:45:00Z",
      "completed_at": "2026-07-31T01:02:00Z",
      "input_commit": "3fe347c5a9bdcd15a3f24b3e4fb2b2c4a277a427",
      "input_hashes": {
        "specs/004-minimal-knowledge-store/tasks.md": "4d3786fc9c444c95f630984d5efb55f24cfd415452d73a97eab9b38b15de0b2c"
      },
      "agent_role": "task-author",
      "evidence_paths": [
        "specs/004-minimal-knowledge-store/tasks.md"
      ],
      "failure": null
    },
    {
      "stage": "analyze",
      "status": "invalidated",
      "started_at": "2026-07-31T01:02:00Z",
      "completed_at": "2026-07-31T01:02:00Z",
      "input_commit": "3fe347c5a9bdcd15a3f24b3e4fb2b2c4a277a427",
      "input_hashes": {},
      "agent_role": "bmad-sprint-orchestrator",
      "evidence_paths": [],
      "failure": null
    },
    {
      "stage": "implement",
      "status": "accepted",
      "started_at": "2026-07-31T01:02:00Z",
      "completed_at": "2026-07-31T07:05:20Z",
      "input_commit": "3fe347c5a9bdcd15a3f24b3e4fb2b2c4a277a427",
      "input_hashes": {
        "specs/004-minimal-knowledge-store/tasks.md": "4d3786fc9c444c95f630984d5efb55f24cfd415452d73a97eab9b38b15de0b2c"
      },
      "agent_role": "tdd-implementer",
      "evidence_paths": [
        "src/dotnet/Vulgata.Core/DomainServices/KnowledgeStoreContracts.cs",
        "src/dotnet/Vulgata.Infrastructure/Data/KnowledgeStoreRepository.cs",
        "tests/Vulgata.Tests/KnowledgeStoreDomainTests.cs",
        "tests/Vulgata.Tests/KnowledgeStorePersistenceTests.cs",
        "tests/Vulgata.Tests/KnowledgeStoreRetrievalTests.cs"
      ],
      "failure": null
    },
    {
      "stage": "acceptance-review",
      "status": "invalidated",
      "started_at": "2026-07-31T07:05:20Z",
      "completed_at": "2026-07-31T07:05:20Z",
      "input_commit": "5329504b5f7cfaf5bde2dd8de006b9243f6076b5",
      "input_hashes": {},
      "agent_role": "bmad-sprint-orchestrator",
      "evidence_paths": [],
      "failure": null
    },
    {
      "stage": "quality-review",
      "status": "accepted",
      "started_at": "2026-07-31T08:18:47Z",
      "completed_at": "2026-07-31T09:02:55Z",
      "input_commit": "4b84e0dedfee5a11520894bf9e2d755e2e687c6c",
      "input_hashes": {
        "docs/bmad/implementation-artifacts/11-1-minimal-knowledge-store-and-retrieval-projection.md": "16ca49ecbbee5fcbc207bd5eca4ec49dd631f25521e82798117a62dfec6044d0"
      },
      "agent_role": "quality-reviewer",
      "evidence_paths": [
        "specs/004-minimal-knowledge-store/reviews/quality-review/quality-review-recovery-f23f6ee.json"
      ],
      "failure": null
    },
    {
      "stage": "conditional-e2e",
      "status": "accepted",
      "started_at": "2026-07-31T08:30:00Z",
      "completed_at": "2026-07-31T09:02:55Z",
      "input_commit": "f23f6ee38d1dc6602dde43d4e2a1b4aa54e03b4d",
      "input_hashes": {},
      "agent_role": "e2e-runner",
      "evidence_paths": [
        "specs/004-minimal-knowledge-store/evidence/story-11-1-final-verification.txt"
      ],
      "failure": null
    },
    {
      "stage": "verify",
      "status": "accepted",
      "started_at": "2026-07-31T09:00:00Z",
      "completed_at": "2026-07-31T09:02:55Z",
      "input_commit": "f23f6ee38d1dc6602dde43d4e2a1b4aa54e03b4d",
      "input_hashes": {},
      "agent_role": "bmad-sprint-orchestrator",
      "evidence_paths": [
        "specs/004-minimal-knowledge-store/evidence/story-11-1-final-verification.txt"
      ],
      "failure": null
    },
    {
      "stage": "complete",
      "status": "accepted",
      "started_at": "2026-07-31T09:02:55Z",
      "completed_at": "2026-07-31T09:02:55Z",
      "input_commit": "f23f6ee38d1dc6602dde43d4e2a1b4aa54e03b4d",
      "input_hashes": {},
      "agent_role": "bmad-sprint-orchestrator",
      "evidence_paths": [
        "docs/bmad/implementation-artifacts/11-1-minimal-knowledge-store-and-retrieval-projection.md",
        "specs/004-minimal-knowledge-store/evidence/story-11-1-final-verification.txt"
      ],
      "failure": null
    }
  ],
  "repository_preflight": {
    "branch": "codex/story-11-1-knowledge-store",
    "preflight_head": "f23f6ee38d1dc6602dde43d4e2a1b4aa54e03b4d",
    "repository_root": ".",
    "git_common_directory": "G:/source/repos/vulgata/.git",
    "worktree_path": "C:/Users/13728/.codex/worktrees/32ea/vulgata",
    "worktree_status": "?? specs/004-minimal-knowledge-store/reviews/",
    "owned_paths": [
      "docs/bmad/implementation-artifacts/11-1-minimal-knowledge-store-and-retrieval-projection.md",
      "docs/bmad/implementation-artifacts/workflow-activations/11-1-minimal-knowledge-store-and-retrieval-projection.json",
      "docs/bmad/implementation-artifacts/sprint-status.yaml",
      "specs/004-minimal-knowledge-store/evidence/story-11-1-final-verification.txt",
      "specs/004-minimal-knowledge-store/reviews/quality-review/quality-review-recovery-f23f6ee.json",
      "specs/004-minimal-knowledge-store/tasks.md",
      "specs/004-minimal-knowledge-store/workflow-state.json"
    ],
    "unrelated_paths": [],
    "observed_at": "2026-07-31T09:02:55Z"
  },
  "source_artifacts": [
    {
      "authority": "BMad development record",
      "path": "docs/bmad/implementation-artifacts/11-1-minimal-knowledge-store-and-retrieval-projection.md",
      "commit": "bf130ca7e5aa662dda1a86e5bbca9c7a8c370d88",
      "sha256": "16ca49ecbbee5fcbc207bd5eca4ec49dd631f25521e82798117a62dfec6044d0"
    },
    {
      "authority": "SpecKit specification",
      "path": "specs/004-minimal-knowledge-store/spec.md",
      "commit": "bf130ca7e5aa662dda1a86e5bbca9c7a8c370d88",
      "sha256": "c7a36a49663eef0a556d5488a4d832ef5c9bf8aa12bb01ecedc87e4a23e5843d"
    },
    {
      "authority": "SpecKit plan",
      "path": "specs/004-minimal-knowledge-store/plan.md",
      "commit": "bf130ca7e5aa662dda1a86e5bbca9c7a8c370d88",
      "sha256": "3b1ff499ef67d7a2d072813631a01f993648e27e90e5379735fcaf2de97d7184"
    },
    {
      "authority": "SpecKit tasks",
      "path": "specs/004-minimal-knowledge-store/tasks.md",
      "commit": "bf130ca7e5aa662dda1a86e5bbca9c7a8c370d88",